id,authorId,comment,publishedDate,photoId
1,2,Absolutely stunning — those colors are unreal!,2026-04-01T10:15:00+00:00,1
2,4,"The composition draws me in, great work.",2026-04-01T11:30:00+00:00,1
3,1,"That sunset glow is perfect, amazing capture.",2026-04-02T08:45:00+00:00,1
4,3,"I could stare at this all day, beautiful framing.",2026-04-02T14:20:00+00:00,1
5,5,"Incredible perspective and tones, love it.",2026-04-03T09:00:00+00:00,1
6,6,The cherry blossoms look magical in this light.,2026-04-03T10:10:00+00:00,2
7,7,Love the depth of field here.,2026-04-03T12:00:00+00:00,2
8,8,Such soft colors and great mood.,2026-04-04T07:30:00+00:00,2
9,9,This shot makes me want to visit in spring.,2026-04-04T15:45:00+00:00,2
10,10,Perfect timing and color balance!,2026-04-05T09:20:00+00:00,2
11,11,Wonderful framing and detail.,2026-04-05T11:00:00+00:00,18
12,12,The mood in this image is fantastic.,2026-04-05T13:30:00+00:00,18
13,13,Stunning composition — great eye!,2026-04-06T08:15:00+00:00,18
14,14,This place is on my travel list now!,2026-04-06T10:45:00+00:00,18
15,15,"That light is gorgeous, very atmospheric.",2026-04-06T16:00:00+00:00,18
16,16,"Powerful photo, full of energy!",2026-04-07T09:00:00+00:00,25
17,1,"What an action shot, love the movement.",2026-04-07T11:15:00+00:00,25
18,2,Excellent timing and clarity.,2026-04-07T14:00:00+00:00,25
19,3,This image really captures the excitement.,2026-04-08T08:30:00+00:00,25
20,4,"Amazing moment, great capture!",2026-04-08T12:00:00+00:00,25
21,5,"Bali beach vibes, I can almost hear the waves.",2026-04-08T15:20:00+00:00,3
22,6,That sky and water combo is dreamy.,2026-04-09T09:45:00+00:00,3
23,7,Beautiful colors and composition.,2026-04-09T13:10:00+00:00,3
24,8,Fantastic jump and motion freeze.,2026-04-10T08:00:00+00:00,11
25,9,"Love the action, crisp and exciting.",2026-04-10T11:30:00+00:00,11
26,10,Great jump timing — awesome capture!,2026-04-10T14:45:00+00:00,11
27,11,This gallery shot has such a calming mood.,2026-04-11T09:00:00+00:00,16
28,12,Amazing composition and color here.,2026-04-11T12:20:00+00:00,16
29,13,"Color grading is wonderful, great mood.",2026-04-11T15:00:00+00:00,16
30,14,"Great action shot, crisp and exciting.",2026-04-12T08:45:00+00:00,20
31,15,"Perfect timing, clarity is excellent.",2026-04-12T11:00:00+00:00,20
32,16,The energy in this frame is fantastic.,2026-04-12T14:30:00+00:00,20
33,1,"This scene made me smile, amazing capture.",2026-04-13T09:15:00+00:00,22
34,2,Lovely tones and composition.,2026-04-13T12:00:00+00:00,22
35,3,"Wonderful moment, beautifully shot.",2026-04-13T16:00:00+00:00,22
36,4,Love the brush strokes and colors in this painting.,2026-04-14T08:30:00+00:00,28
37,5,This piece would be perfect on a gallery wall.,2026-04-14T11:45:00+00:00,28
38,6,"Great detail and texture, nicely captured.",2026-04-14T15:00:00+00:00,28
39,7,"Such vibrant wildflowers, brings me joy.",2026-04-15T09:00:00+00:00,5
40,8,Beautiful colors and natural framing.,2026-04-15T12:30:00+00:00,5
41,9,Alpine meadow looks peaceful and fresh.,2026-04-16T08:15:00+00:00,6
42,10,"Love the wide view, feels expansive.",2026-04-16T11:00:00+00:00,6
43,11,"Tropical vibes are strong here, stunning.",2026-04-16T14:45:00+00:00,7
44,12,"Looks so relaxing, great capture.",2026-04-17T09:30:00+00:00,7
45,13,Misty lake dock sets a serene mood.,2026-04-17T12:00:00+00:00,8
46,14,This composition is so calming.,2026-04-17T15:20:00+00:00,8
47,15,"Interesting sculpture, great shot.",2026-04-18T08:45:00+00:00,9
48,16,The reflections and shapes are beautiful.,2026-04-18T11:30:00+00:00,9
49,1,Downhill ski action looks intense and fun!,2026-04-18T14:00:00+00:00,10
50,2,Great action and exposure control.,2026-04-19T09:00:00+00:00,10
51,3,Beautiful interplay of art and nature.,2026-04-19T11:15:00+00:00,12
52,4,Lovely arrangement and lighting.,2026-04-19T14:30:00+00:00,12
53,5,Golden wave surf — pure bliss!,2026-04-20T08:30:00+00:00,13
54,6,The motion and light here are superb.,2026-04-20T12:00:00+00:00,13
55,7,Modern art gallery shot has great lines.,2026-04-20T15:45:00+00:00,14
56,8,Nice composition and perspective.,2026-04-21T09:00:00+00:00,14
57,9,Portrait on canvas looks very expressive.,2026-04-21T12:30:00+00:00,15
58,10,Lovely work and framing.,2026-04-21T15:00:00+00:00,15
59,11,"I feel like I'm there, gorgeous scene.",2026-04-22T08:45:00+00:00,19
60,12,"Beautiful texture, great eye for detail.",2026-04-22T12:00:00+00:00,21
61,13,Fantastic framing and natural light.,2026-04-22T15:30:00+00:00,23
62,14,"Stunning scenery, the light is perfect.",2026-04-23T09:00:00+00:00,24
63,15,"Such a calm and peaceful image, nicely done.",2026-04-23T12:15:00+00:00,26
64,16,The waterfall looks majestic here.,2026-04-23T15:45:00+00:00,27
65,1,Beautiful portrait with lovely expression.,2026-04-24T08:30:00+00:00,29
66,2,This road trip capture makes me want to pack my bags.,2026-04-24T11:00:00+00:00,30
67,3,"Incredible expression on the runner, feels real!",2026-04-24T14:30:00+00:00,31
68,4,This piece would be perfect on a gallery wall.,2026-04-25T09:00:00+00:00,32
69,5,I love the perspective in this landscape.,2026-04-25T12:00:00+00:00,34
70,6,Perfect getaway vibes in this shot.,2026-04-25T15:00:00+00:00,35
71,7,This scene has a tranquil charm.,2026-04-26T09:30:00+00:00,36
72,8,Fantastic subject and clarity.,2026-04-26T12:00:00+00:00,37
73,9,Great composition and color.,2026-04-26T14:45:00+00:00,38
74,10,Lovely detail and atmosphere.,2026-04-27T08:00:00+00:00,39
