id,description,publishedDate,categoryId,albumId
1,A field of vibrant wildflowers stretching across an alpine meadow under a warm sky.,2026-03-05,4,8
2,"Hiker pausing at an ancient mountain ruin, the trail winding through dramatic stone terraces.",2026-02-20,2,1
3,Sunset at a canyon overlook with layered cliffs glowing in golden light.,2026-04-12,4,1
4,Gallery wall filled with contemporary works and minimalist installations.,2026-01-18,1,10
5,Framed portrait on canvas displayed in a quiet museum gallery.,2026-04-01,3,2
6,Close-up portrait of a soccer striker mid-kick under bright stadium lights.,2026-03-28,1,3
7,"Narrow alley lined with traditional lanterns, warm evening light and textured walls.",2026-02-11,1,9
8,"A pair of beach chairs under an umbrella on a tropical shore, turquoise sea beyond.",2026-03-01,3,5
9,"Sleek silver sculptures arranged in a garden, reflecting the sky and surrounding greenery.",2026-04-04,4,10
10,"Skier catching air on a steep snowy slope, powder trailing behind.",2026-02-25,3,11
11,Traveler overlooking an ancient mountain citadel on a misty trail.,2026-03-11,4,13
12,A multi-tiered waterfall cascading over moss-covered rock into a serene pool.,2026-02-02,2,25
13,"Surfer riding a glowing golden wave at sunrise, spray highlighted by the light.",2026-03-19,3,7
14,Interior of a modern art gallery showing large-scale abstract paintings.,2026-01-31,2,2
15,Vintage framed portrait photographed against a neutral gallery wall.,2026-04-20,4,34
16,"Runner breaking the tape at a marathon finish, crowd cheering in the background.",2026-03-08,4,38
17,"An ornate baroque fresco on a cathedral ceiling, figures and cherubs in motion.",2026-02-14,4,36
18,"Wide turquoise sky over tranquil sea, soft clouds and late-afternoon light.",2026-04-07,4,12
19,Ski jumper frozen mid-air against a bright blue alpine sky.,2026-03-22,3,39
20,"A vintage camper van parked by an open road, a classic road trip scene.",2026-01-05,1,22
21,A small framed portrait with rich brushwork and warm tones.,2026-03-16,3,41
22,Abstract ocean wave painting in shades of blue and teal.,2026-02-28,4,37
23,Decorative fresco ceiling with painted allegorical scenes.,2026-04-10,1,10
24,Suspension bridge through a forested gorge — a hiker crosses toward the mountain.,2026-03-02,3,13
25,A basketball arcing toward a hoop on an outdoor court at golden hour.,2026-04-18,3,11
26,Close-up of a football boot resting on a patterned match ball on grass.,2026-02-07,2,7
27,"Travel flatlay with a world map, passport and travel ephemera suggesting adventure.",2026-01-29,2,28
28,Colorful artist palette and thick paint textures captured in detail.,2026-03-04,1,20
29,Friends laughing and wading together in shallow ocean water on a sunny day.,2026-04-15,3,1
30,Volleyball player spiking the ball mid-air in an indoor match.,2026-01-12,2,11
31,"Portrait painting displayed alone on a white museum wall, soft gallery lighting.",2026-03-21,1,14
32,Close-up abstract painting with layered blue brushstrokes and texture.,2026-02-03,1,31
33,A dramatic mountain valley scene with mist and winding paths — perfect for a hike.,2026-04-25,3,24
34,A late-afternoon view of a canyon and distant mountain illuminated by sun.,2026-02-17,1,20
35,"Athlete lifting a barbell in a studio gym, muscles tensed and focused.",2026-01-27,4,38
36,"Sprinter in starting blocks, ready to explode into motion on the track.",2026-04-06,2,29
37,"A scenic coastal karst formation rising from the sea, viewed from the shore.",2026-03-14,3,8
38,A tranquil lakeshore at dawn with a single tree reflected in still water.,2026-02-24,4,31
39,Deer grazing in a meadow with a towering granite dome in the background.,2026-04-02,3,15
40,A tall waterfall plunging into a forested basin framed by greenery.,2026-01-09,1,43
